Checked out to  Name,user email,Category,Name,Manufacturer,Model,SerialNumber,CheckoutEquipmentID,RoomNumber,DANMSpecs,purchase date,purchase cost,,Cables-Adapters-Dongles,MiniDisplay Port to DVI Dongle,Apple,,,420768,,,,,,Converters-Switches-Splitters,Sony AV Switch,Sony,SB-V40,n/a,420139,,"(4) RCA inputs, (1) RCA output and (1) 1/8"" TRS output.",,,,Converters-Switches-Splitters,Terk AV Switch,Terk,VS-4,27808672,420140,,"(4) RCA & S-Video inputs, (1) RCA & S-Video output and (1) 1/8"" TRS output.",,,,Converters-Switches-Splitters,PC to Video EX Switcher,Grandtec,GEZ-1000,200908200673479,420524,,"VGA input, VGA/S-Video/Composite output.switcher, VGA, S-Video, RCA, USB to DC cable, and user guide.",,,,Converters-Switches-Splitters,AV Switch,RadioShack,15-1976,07A02,420652,,"(4) RCA & S-Video inputs, (1) RCA & S-Video output.",,,,Converters-Switches-Splitters,AverKey iMicro PC/Mac to TV Scan Converter,AverMedia,KOC3,30496 2030,420306,,"PC/Mac-to-TV conversion - can easily project any computer application onto a big screen TV or save it into a VCR. Start a business presentation, create training tapes, display animations, play games or surf the Internet on a big TV Screen in seconds. AVerMedia AVerKey iMicro supports resolutions up to 1280 x 1024 for both PC and Mac. It comes with Touch-Button control panel, zoom and pan, picture positioning and much mo Converter box, 7.5V dc power supply.",,,,Mobile Devices,iPod Touch,Apple,A1288,8k0024yn75j,420372,,"8 GB capacity iPod, plastic hardshell case.",,,,Video Miscellaneous,AV Distribution Amplifier,datavideo,VP-299,10203,420065,,"(1) RCA & S-Video input, and (4) RCA & S-Video outputs.amplifier console, 12V dc power supply",,,,Video Miscellaneous,RF Modulator,Gemini,PH61159,613,420194,,RF Modulator with Composite and S-Video Inputs,,,,VR/Video Game Equipment,XBOX Gaming System 420720,Microsoft,232301240424605,301240424605,420720,,"Gaming system set for three players, with one game included in the kit. XBOX console, (2) HipGear wireless controllers with wireless controller host, wired XBOX controller, RCA cable, IAC power cable, and ""Tony HAwk Pro Skater 4"" game.",,,,Displays,"17"" Cinema Display",Apple,A1081,2A602012UFZ,420094,0104,"DVI, USB, and Firewire 400 connection.monitor, 65w power adapter (model: A1096).",,,,Displays,"S1 17"" LCD Widescreen Display",Acer,AL1913W bm,ETL430900553000317PQ00,420105,0151,VGA connection. Monitor and 12Vdc to AC power supply.,,,,General,"12"" Desk Fan",HomeBasix,,628-5456,420770,0203A,,,,,Projectors,Slide Projector and Monitor,,,,420837,0203A,,,,,Projectors,Projector Screen Material,Carl's Place,,,420871,0203B,2'' Polyester Felt,,,,Video Players-Recorders,Portable TV/DVD Player,broksonic,CCVG-297,065221004953,420849,0203B,,,,,Audio Miscellaneous,Proteus/1 Plus Orchestral Rack-Mounted Sound Module,E-mu Systems,9025,019301651D,420772,0203C,"This rack-mounted module offers 384 sound samples; MIDI inputs and 1/4"" outputs.",,,,Audio Miscellaneous,Proteus/1 Plus Orchestral Rack-Mounted Sound Module,E-mu Systems,9025,019301636D,420771,0203C,"This rack-mounted module offers 384 sound samples; MIDI inputs and 1/4"" outputs.",,,,Audio Miscellaneous,"Camera Mounted XLR to 1/8"" stereo",Beachtek,DXA-4P,n/a,420714,0203C,"This allows one to use a stereo balanced xlr mic in to a trss 1/8"" connector. Perfect for a powered shotgun mic on top of an SLR camera. This unit will work with all camcorders (including Canon GL-1, Optura PI, ZR-10, Panasonic AG-EZ1 and AG-DVC10) with the exception of the Sony DCR-VX1000, VX700 and Panasonic AG-EZ30.",,,,Audio Miscellaneous,Micro-Phono PP400 Preamp,Behringer,PP400,s1314100492,420857,0203C,,,,,Audio Miscellaneous,Korg Little Bits Synth Kit,,,,420907,0203C,,,,,Audio Miscellaneous,Polycom Sound Station 420953,Polycom,,12794184,420953,0203C,,,,,Audio Miscellaneous,Headphones Sony MDR-ZX100,Sony,MDR-ZX100,,420955,0203C,,,,,Audio Miscellaneous,Headphones Sony MDR-ZX100,Sony,MDR-ZX100,,420959,0203C,,,,,Audio Miscellaneous,Headphones Sony MDR-ZX100,Sony,MDR-ZX100,,420958,0203C,,,,,Audio Miscellaneous,Headphones Sony MDR-ZX100,Sony,MDR-ZX100,,420957,0203C,,,,,Audio Miscellaneous,Headphones Sony MDR-ZX100,Sony,MDR-ZX100,,420956,0203C,,,,,Audio Mixers,Rolls MX422 Field Mixer,Rolls,MX422,523736,420082,0203C,"Portable field mixer; four channel inputs, microphone/line mixer with balanced XLR inputs and outputs. Mixer, nylon carrying case with shoulder strap, 12Vdc power supply, 1/8"" to 1/8"" cable, and User Guide.",,,,Audio Mixers,Rolls HA43 Headphone Amplifier,Rolls,HA43,5461127,420114,0203C,"Four 1/4"" ins/outs to one 1/4"" in/out. headphone amplifier, 12VDC power supply",,,,Audio Mixers,Headphone Amp,Artceessories,n/a,n/a,420119,0203C,"Four output stereo headphone amp Head Amp, 12V DC power supply",,,,Audio Mixers,Multimix8 Firewire Mixer,Alesis,Multimix8 Firewire,ALXF1005301,420141,0203C,"Mixer, USB A to B, Firewire 400 cable, (2) 1/4"" to 1/4"" cables, 18V power supply, padded carrying case, and User Manual.",,,,Audio Mixers,"4 Channel Stereo Mixer, Passive",Rolls,MX41b,641927,420186,0203C,"4 stereo inputs (1/4 inch and 3.5mm) with sliders, and one stereo output (1/4 inch and 3.5mm). Good as a small mixer and for headphone splitter.",,,,Audio Mixers,4-Channel Ultra-Compact Mixer 420859,,,,420859,0203C,,,,,Audio Recorders,Marantz Solid State Recorder,Marantz,PMD660,20020527013130,420067,0203C,"Recorder, USB A to B cable, 5Vdc power supply, 1 GB Compact Flash card.",,,,Audio Recorders,Marantz Solid State Recorder 420084,Marantz,PMD660,20020527013129,420084,0203C,"Marantz, AC power adapter (model no. DA660PMD) with 2 pin IAC cable, 2 GB CompactFlash card",,,,Audio Recorders,Marantz Solid State Recorder 420085,Marantz,PMD660,20010516008717,420085,0203C,"Recorder, 2 GB Compact Flash card, 5V DC power supply, USB A to B cable, and shoulder strap.",,,,Audio Recorders,Marantz Solid State Recorder 420089,Marantz,PMD660,20010516008716,420089,0203C,"Marantz, AC power adapter (model no. DA660PMD) with 2 pin IAC cable, Recorder corded remote, USB A/B cable, 2 GB CompactFlash card, black nylon carrying case, shoulder strap attached to the recorder",,,,Audio Recorders,Voice Path JK Audio,"JK Audio, Inc.",,VP01949,420278,0203C,"Phone tap recorder voice path module with connected cables, telephone line",,,,Audio Recorders,Zoom H2 Handy Recorder 420337,Zoom,H2,216361,420337,0203C,"Digital audio recorder with 1 GB SD card and internal mics. Recorder, 1 GB SD card, 9Vdc power supply, 1/8"" to RCA cable, recorder stand, recorder handle, silicon case, and User Manual.",,,,Audio Recorders,Zoom H4n Handy Recorder,Zoom,H4n,99956,420408,0203C,"Digital audio recorder with 1 GB SD card, two XLR (or 1/4) inputs, and internal mics.Recorder, plastic hardshell case, mini-tripod, windscreen, 5Vdc/1A power supply, USB to mini USB cable, 1GB SD card in recorder, and User Manual.",,,,Audio Recorders,Voice Path JK Audio,"JK Audio, Inc.",,VP02124,420446,0203C,"Phone tap recorder voice path module with connected cables, telephone line voice path module with connected cables, telephone line",,,,Audio Recorders,Zoom H2n Handy Recorder 420672,Zoom,H2n,13631,420672,0203C,"Digital audio recorder with internal mic and 1/8"" line in; comes with 2GB SD card. Recorder, 2 GB SD card, foam windscreen, furry windscreen, UBS to AC power adapter, USB to mini USB cable, 1/8"" remote control, 1/8"" extension cable, mini tripod, mic clip handle, and User Manual.",,,,Audio Recorders,Portable Cassette Recorder     ,Panasonic,RQ-2102,UA3GB002819,420885,0203C,,,,,Cables-Adapters-Dongles,"50"" VGA Cable",n/a,n/a,n/a,420103,0203C,,,,,Cables-Adapters-Dongles,"70"" Firewire 400 Cable",n/a,n/a,n/a,420166,0203C,,,,,Cables-Adapters-Dongles,MiniDisplay Port to DVI Dongle,Xcellon,n/a,n/a,420168,0203C,,,,,Cables-Adapters-Dongles,MiniDisplay Port to DVI Dongle,Xcellon,n/a,n/a,420249,0203C,,,,,Cables-Adapters-Dongles,MiniDisplay Port to DVI Dongle,Xcellon,n/a,n/a,420255,0203C,,,,,Cables-Adapters-Dongles,DVI to VGA adapter,Apple,n/a,n/a,420477,0203C,,,,,Cables-Adapters-Dongles,MiniDisplay Port to VGA Dongle 420501,Xcellon,n/a,,420501,0203C,,,,,Cables-Adapters-Dongles,HDMI Extender,n/a,n/a,n/a,420522,0203C,"HDMI coupler, 5V AC/DC power adapter.",,,,Cables-Adapters-Dongles,MiniDisplay Port to VGA adapter,Apple,A1307,n/a,420627,0203C,,,,,Cables-Adapters-Dongles,"50"" VGA Cable",n/a,n/a,n/a,420633,0203C,,,,,Cables-Adapters-Dongles,DVI to VGA adapter,Apple,n/a,n/a,420648,0203C,,,,,Cables-Adapters-Dongles,DVI to VGA adapter,Apple,n/a,n/a,420649,0203C,,,,,Cables-Adapters-Dongles,MiniDisplay Port to DVI Dongle,Xcellon,n/a,n/a,420658,0203C,,,,,Cables-Adapters-Dongles,DVI to VGA adapter,Apple,n/a,n/a,420671,0203C,,,,,Cables-Adapters-Dongles,MiniDisplayPort to DVI with USB adapter,Apple,A1306,,420732,0203C,,,,,Cables-Adapters-Dongles,"70"" Firewire 400 Cable",n/a,n/a,n/a,420740,0203C,,,,,Cables-Adapters-Dongles,"50"" VGA Cable",n/a,n/a,n/a,420742,0203C,,,,,Cables-Adapters-Dongles,"50"" VGA Cable",n/a,n/a,n/a,420785,0203C,,,,,Cables-Adapters-Dongles,"50"" VGA Cable",n/a,n/a,n/a,420786,0203C,,,,,Cables-Adapters-Dongles,"75"" VGA Cable",n/a,n/a,n/a,420787,0203C,,,,,Cables-Adapters-Dongles,MiniDisplay Port to VGA Dongle,Xcellon,n/a,n/a,420790,0203C,,,,,Cables-Adapters-Dongles,MiniDisplay Port to VGA Dongle,Xcellon,n/a,n/a,420791,0203C,,,,,Cables-Adapters-Dongles,MiniDisplay Port to VGA Dongle,Xcellon,n/a,n/a,420792,0203C,,,,,Cables-Adapters-Dongles,VGA over Cat5 Extender,TrippLite,B130-101,9849ACPCB729200199B,420478,0203C,"Extender sender box, AC adapter & IAC power supply, Extender Remote box Unit, (2) VGA cables",,,,Cables-Adapters-Dongles,iPhone/iPad to VGA Out Cable,Apple,A1368,n/a,420618,0203C,"30-pin to VGA out adapter; Works with iPad, iPhone, iPod Touch.",,,,Cables-Adapters-Dongles,MiniDisplayPort to DVI with USB adapter,Apple,A1306,885909240012,420625,0203C,,,,,Cables-Adapters-Dongles,iPad to USB Adapter,Apple,A1358,n/a,420762,0203C,,,,,Cables-Adapters-Dongles,USB Extender (cat 5),IOGEAR,GUCE51,OU77USM7105006,420455,0203C,"Model GUCE51 operates at up to 198 feet over standard Category 5 networking cable. Suitable for USB 1.1. You supply the desired length of Cat 5 cable with RJ45 M connectors.Model a is a single port USB 2.0 hub that buffers upstream and downstream data traffic. Both low-speed and high-speed devices work equally well. The cable length is 5 meters. By putting up to five cables in series, you can achieve distances of up to 25m. For USB 2.0 and backward compatible with 1.0 and 1.1.Active USB extension (works as a 1 port hub)Works with USB 2.0, and backward compatible with 1.0 and 1.1No power supply requiredConnectors are Type A female (downstream) and Type A male (upstream)",,,,Cables-Adapters-Dongles,iPad to SD Card Reader,Apple,A1362,n/a,420761,0203C,,,,,Cables-Adapters-Dongles,GigaWare USB Extender (cat 5),Gigaware,09A07,n/a,420335,0203C,2 Gigaware connectors,,,,Cables-Adapters-Dongles,HDMI to Mini Display Dongle 420897,Moshi,,,420897,0203C,,,,,Cables-Adapters-Dongles,Thunderbolt to Cat5,,,,420879,0203C,,,,,Cables-Adapters-Dongles,MiniDisplay Port to DVI Dongle,Apple,,,420920,0203C,,,,,Cables-Adapters-Dongles,DVI to VGA Dongle,Apple,,,420921,0203C,,,,,Cables-Adapters-Dongles,DVI to VGA Dongle,Apple,,,420923,0203C,,,,,Cables-Adapters-Dongles,DVI to VGA Dongle,Apple,,,420922,0203C,,,,,Cables-Adapters-Dongles,(F)HDMI to Ipod Adapter,Apple,,,420924,0203C,,,,,Cables-Adapters-Dongles,MacDisplay Port to VGA Adapter,Apple,,,420925,0203C,,,,,Cables-Adapters-Dongles,Mini-DVI(M) to DVI Dongle,Apple,,,420926,0203C,,,,,Cables-Adapters-Dongles,Mini-DVI(M) to VGA Adapter,Apple,,,420927,0203C,,,,,Cables-Adapters-Dongles,Mini-DVI(M) to DVI Adapter,Apple,,,420928,0203C,,,,,Cables-Adapters-Dongles,HDMI to DVI(F) Adapter,Apple,,,420929,0203C,,,,,Cables-Adapters-Dongles,Video Adapter to DVI,Apple,,,420933,0203C,,,,,Cables-Adapters-Dongles,Mini-DVI(M) to DVI,Apple,,,420932,0203C,,,,,Cables-Adapters-Dongles,Mini Display to HDMI Dongle 420983,,,,420983,0203C,,,,,Cables-Adapters-Dongles,VGA to DVI Dongle 420986,,,,420986,0203C,,,,,Cables-Adapters-Dongles,VGA to DVI Dongle 420987,,,,420987,0203C,,,,,Cables-Adapters-Dongles,VGA to DVI Dongle 420988,,,,420988,0203C,,,,,Cables-Adapters-Dongles,Thunderbolt to Ethernet Dongle 420989,,,,420989,0203C,,,,,Cameras,Color CCTV Camera Panasonic,Panasonic,WV-CP480,EBA13737,420016,0203C,"Infrared security camera: Doubel speed CCD color image sensor, swicthes from B/W mode to color mode automatically or manually, pixel-based 128x dynamic range with area free natural. CCTV camera body, Pentax 2.8-12mm lens (model: TS4V214)",,,,Cameras,Pan/Tilt/Zoom Color SONY Video Camera,Sony,EVID70,105786,420081,0203C,"Robotic pan/tilt/zoom color video camera, fully remote-controllable and mountable; Resolution: 768x494, 18x optical zoom & 12x digital zoom; Runs over s-video and RCA.camera, mounting hardware, remote, 12V AC power adapter, s-video cable",,,,Cameras,3CCD Panasonic MiniDV Camera,Panasonic,PV-GS150,F5HX52117,420083,0203C,"MiniDV format, portable ""palmcorder""; 2.3 megapixels, 10X optical zoom, 700x digital zoom; camera, 2gb SD card, li-ion rechargable battery, panasonic battery charger, 1/8"" TRS to RCA cable, TRS camera remote control and microphone, remote, camera neck strap, Panasonic Digital Palmcorder software CD",,,,Cameras,Color Firewire Astronomy Camera,The Imaging Source,DBK 21AF04,900004,420088,0203C,"Resolution: 640x480 pixels, up to 60 FPS and 60 minutes exposure; software required for use: http://www.astronomycameras.com/products/firewire/dbk21af04as/ Camera, aluminum mount, Firewire 400 cable.",,,,Cameras,3CCD Panasonic MiniDV Camera,Panasonic,PV-GS150,F5HX52119,420102,0203C,"MiniDV format, portable ""palmcorder""; 2.3 megapixels, 10X optical zoom, 700x digital zoom;camera, 2gb SD card, li-ion rechargable battery, power2000 CGA-DU21 li-ion rechargable battery, panasonic battery charger,, DC battery power adapter, 1/8"" to RCA cableTRS camera remote control and microphone, remote, camera neck strap, Panasonic Digital Palmcorder software CD, lowel pro padded carrying case w/ shoulder strap",,,,Cameras,3CCD Panasonic MiniDV Camera,Panasonic,PV-GS150,D5HA50753,420108,0203C,"MiniDV format, portable ""palmcorder""; 2.3 megapixels, 10X optical zoom, 700x digital zoom; camera, 1gb SD card, li-ion rechargable battery, panasonic battery charger, DC battery power adapter, TRS camera remote control and microphone, remote, 1/8"" to RCA cable, Panasonic Digital Palmcorder software CD, lowel pro padded carrying case w/ shoulder strap",,,,Cameras,Nikon D80 DSLR Camera,Nikon,D80,3164921,420159,0203C,"Nikon Digital SLR Camera with no video recording. This is just the camera body, attachable lenses can be checked out with it. Resolution: 10.2 megapixels, ISO 100-1600. Camera, 16Gb SD card, (2) Nikon Li-ion rechargable batteries, battery quick charger (model: MH-18a), lens connection cap, neck strap, microfiber cleaning cloth, LCD screen protector, padded Nikon carring case with neck strap.",,,,Cameras,Canon Rebel XTi DSLR ,Canon,DS126151,920417617,420185,0203C,"Canon XTi Digital SLR Camera body; 10.1 megapixels, 5.0x optical zoom, ISO 100-1600, pop-up flash; camera body, neck strap, 1Gb compactflash card, Canon li-ion battery, Canon AC power adapter (model: CA-PS700 N), USB to mini USB cable, camera remote, battery charger, pocket guide, user manual,. padded pelican case.",,,,Cameras,Wireless Camera Kit 420195,CMOS,RLC-907B?,n/a,420195,0203C,"Mini, high-sensitivity wireless camera with optional 9V battery attachment or AC wall adapter, with Radio AV Reciever. Mini Camera with antenna, rotating mini camera mount, DC to 9V battery adapter, 8V DC power supply, Radio AV reciever with antenna, 8V DC power supply (model: XP60-080050), RCA cable.",,,,Cameras,Flip Handheld Video Camera,PureDigital,F160W,n/a,420215,0203C,Handheld video camera with USB terminal and attached handstrap; Requires (2) AA batteries for use.,,,,Cameras,iSight Webcam,Apple,A1023,6M5212A8SGGJ,420234,0203C,"Small webcam with optional mounts, F2.8 autofocus 50 mm lens, and optional privacy lens cover.",,,,Cameras,iSight Webcam,Apple,A1023,6M5212AUSGJ,420235,0203C,"Small webcam with optional mounts, F2.8 autofocus 50 mm lens, and optional privacy lens cover.",,,,Cameras,Panasonic Network Video Camera with Remote,Panasonic,BB-HCM381A,5ACDA001545,420303,0203C,"Robotic video camera controlled via web page with ethernet streaming video and composite video out. Resolution: 320x240 (default), 640x480 (maximum), image trasnfer via email, 42x max zoom;",,,,Cameras,Epic Action Stealth Video Camera,Epic,STC-EPIC1,D 283905,420336,0203C,"Small low-res video camera, can be strapped to bicycle or helmet. Comes with case that is broken and no longer waterproof, but it somewhat shock proof. Requires two AAA batteries.",,,,Cameras,Canon GL1 MiniDV Camera,Canon,DM-GL1A NTSC,2250200402,420377,0203C,"MiniDV format, NTSC color signal, mounted stereo condenser microphone,",,,,Cameras,Logitech QuickCam USB Webcam,Logitech,V-UM14,LZA24203155,420413,0203C,"Compatable with Windows XP and beyond--requires drivers for use, which can be found online.",,,,Cameras,Sony XDCAM DX Video Camera 420469,Sony,PMW-EX1,105160,420469,0203C,HD Video Camera.,,,,Cameras,Panasonic HD HM-TA1 Video Camera,Panasonic,HM-TA1,SF0SA009668,420509,0203C,"Small, portable full HD video camera with USB terminal; Compatable with Windows XP and beyond, Mac 10.5.8 and beyond.",,,,Cameras,Flip Handheld Video Camera,PureDigital,F230W,GR2082800416,420511,0203C,Handheld video camera with USB terminal and attached handstrap; Requires (2) AA batteries for use.,,,,Cameras,Panasonic HD HM-TA1 Handheld Video Camera,Panasonic,HM-TA1,SF0SA009669,420529,0203C,"Small, portable full HD video camera with USB terminal; Compatable with Windows XP and beyond, Mac 10.5.8 and beyond.",,,,Cameras,Ricoh Digital Still Camera,Rioch,GR Digital,15103795,420623,0203C,"10.4 megapixels, 4.0x digital zoom, movie recording available.",,,,Cameras,Small Mountable Video Camera,n/a,n/a,n/a,420651,0203C,Small camera powered by 12V car power supply? Long S-Video out cable.,,,,Cameras,Canon EOS 5D Mark II,Canon,EOS 5D Mark II,3621706636,420673,0203C,"Type High-sensitivity, high-resolution, large single-plate CMOS sensor Effective pixels: Approx. 21.1 megapixels Total Pixels: Approx. 22.0 megapixels Aspect Ratio 3:2 (Horizontal: Vertical) Full HD Video capture at 1920 x 1080 resolution for up to 4GB per clip with HDMI output for HD viewing of stills and video.",,,,Cameras,Macally USB Webcam,Macally,ICECAM,70921994,420688,0203C,"USB Webcam with adjustable focus and flexible beck; Drivers needed for use, which can be found online.",,,,Cameras,USB LifeCam HD Webcam with Built-in Mic Microsoft,Microsoft,1139,92517-545-1902225-01030,420707,0203C,"HD megapixel sensor, unidirectional microphone built-in; Comptatable with PCs; comes with (3) optional magnetic webcam mounts.",,,,Cameras,Logitech USB Webcam with Built-In Mic,Logitech,V-U0019,LZ13SL,420710,0203C,"Built-in mic, universal clip mount; Compatable with PCs--Windows XP and beyond; requires drivers for use, which can be found online.",,,,Cameras,Logitech HD USB Webcam with Built-In Mic,Logitech,V-U0023,LZ146SC,420711,0203C,"720p video resolution, built-in mic, universal clip mount; Compatable with PCs, Windows XP and beyond. REquires drivers for use, which can be found online.",,,,Cameras,HP HD USB Webcam,HP,HD-3110,CNB1300677,420722,0203C,"Works with Windows XP and beyond, and Mac OS X; 2.0 HP autofocus lens and 720P vidoe resolution.",,,,Cameras,Microsoft LifeCam HD Webcam,Microsoft,1415,219900975962,420724,0203C,"Small USB webcam: 720p, 16:9 aspect ratio, compatible with Windows.",,,,Cameras,BlackMagic Cinema Camera,BlackMagic Design,EF,1400942,420788,0203C,"This medium-format digital film camera offers a touch screen monitor, high resolution 2.5K sensor, 13 stops of dynamic range and 12-bit RAW uncompressed and compressed ProRes and DNxHD file formats. Software included.",,,,Cameras,Canon Ultrasonic EFS 17-55mm DSLR Lens,Canon,EFA 17-55mm,n/a,420801,0203C,This lens has image stablizer technology.,,,,Cameras,Lumix GH1 DSLR Camera,Panasonic,DMC-GH1,WE9KB001009,420375,0203C,,,,,Cameras,GoPro Hero3 Black 420840,GoPro,CHDHX-301,HD3BB0613353561,420840,0203C,,,,,Cameras,Flip Video Camera,Pure Digital Technology,F160W,,"420213",0203C,,,,,Cameras,GoPro Hero3 Black 420860,GoPro,CHDHX-301,HD3BB051,420860,0203C,lost with quadcopter / sharon daniel october 2014,,,,Cameras,Intervalometer Timer Remote Control,JJC,TM-Series,Multi-Function Timer Remote Control,420950,0203C,,,,,Cameras,Canon 60D DSLR with EFS 18-200mm Canon Lens,Canon,EOS 60D,2421406457,420951,0203C,,,,,Cameras,VIXIA mini X,Canon,,812864100274,420960,0203C,,,,,Cameras,Polaroid Cube,Polaroid,Cube,087005325607996,420965,0203C,,,,,Cameras,Quad-Copter,,,PH636045231,420990,0203C,,,,,Computer Accessories,Apple Bluetooth Keyboard,Apple,A1314,n/a,420165,0203C,,,,,Computer Accessories,Apple Magic Trackpad,Apple,A1339,n/a,420622,0203C,,,,,Computer Accessories,Logitech Wireless Mouse,Logitech,C-BN4,LZ715AF,420778,0203C,,,,,Computer Accessories,Magic Trackpad,Apple,A1339,n/a,420769,0203C,,,,,Computer Accessories,Apple USB Keyboard 420898,,,KY01300KMHGX,420898,0203C,,,,,Computer Accessories,USB Mouse 420900,,,40204749,420900,0203C,,,,,Computer Accessories,USB DVD/CD drive,,,,420906,0203C,,,,,Computer Accessories,Mini Display Port to HDMI Adapter,Apple,B002HU629E,,420892,0203C,,,,,Computer Accessories,Mini Display Port to HDMI Adapter,Apple,B002HU629E,,420893,0203C,,,,,Computer Accessories,Mini Display Port to HDMI Adapter,Apple,B002HU629E,,420894,0203C,,,,,Computer Accessories,Logitech wireless Keyboard and Mouse Combo 420936,Logitech,mk270,1433CE16E229,420936,0203C,,,,,Computer Accessories,Leap Motion Keyboard,HP,,7CG4240037,420982,0203C,,,,,Computer Accessories,Kensington Keyboard,Kensington,,99P0781V21A0551002009,420992,0203C,,,,,Computers,Power Mac G5,Apple,A1047,,420006,0203C,"2 GHz, 512 MB RAM, 160 GB;",,,,Computers,Mac Mini (PPC) 420095,Apple,A1103,YM52408NRHR,420095,0203C,Early 2005 PowerPC Mac Mini; 512 MB of RAM; No WiFi Card; Ethernet ID: 0011248BA754; EMC #:2026,,,,Computers,Mac Mini (Intel),Apple,A1176,YM61302PVS5,420110,0203C,"Intel Core Duo 1.66 GHZ, 512MB, 60GB; Airport ID: 00:16:cb:08:87:fb; Ethernet ID: 00:16:cb:94:1b:c9",,,,Computers,Mac Mini (Intel),Apple,A1176,G86462J8W0D,420130,0203C,"Intel Core Duo 1.83 GHz, 1 GB, 80Gb; Ethernet ID: 0016CBA7E0BD",,,,Computers,Power Mac G5,Apple,A1047,G85143LSQPR,420080,0203C,"Dual 2 GHZ PowerPC, 4.5 GB RAM, 160 GB harddrive; Running OS X 10.4.11",,,,Computers,Power Mac G5,Apple,A1047,G8425AS8QPR,420172,0203C,"Dual 2 GHZ PowerPC, 2.5 GB RAM, 160 GB harddrive; Running OS X 10.4.11",,,,Computers,One Laptop Per Child,OLPC,XO-1,10102071227310000128,420222,0203C,,,,,Computers,One Laptop Per Child,OLPC,XO-1,10102071221309999104,420223,0203C,,,,,Computers,Dell Intel Desktop,Dell,DHS,7676W21,420241,0203C,"Ubuntu 10.04 OS: Kernel Linux 2.6.32.45-generic, GNOME 2.30.2; 500 MB of RAM, 40 GB harddisk, Intel Pentium 4 CPU 2.4 GHz;",,,,Computers,Dell Intel Desktop,Dell,DHS,45Y6W21,420244,0203C,"Ubuntu 10.04 OS: Kernel Linux 2.6.32.45-generic, GNOME 2.30.2; 500 MB of RAM, 40 GB harddisk, Intel Pentium 4 CPU 2.4 GHz;",,,,Computers,Dell Intel Desktop,Dell,DHS,H2Y6W21,420246,0203C,"Windows XP OS, Version 2002; Intel Pentium 4 CPU 2.4 GHZ, 512 MB of RAM, 40 GB harddisk;",,,,Computers,Dell Intel Desktop,Dell,DHS,G1Y6W21,420270,0203C,"Ubuntu 10.04 OS: Kernel Linux 2.6.32-45-generic, GNOME 2.30.2; 500 MB of RAM, 40 GB harddisk, Intel Pentium 4 CPU 2.4 GHz;",,,,Computers,Mac Mini (PPC),Apple,A1103,YM52409HRHR,420273,0203C,"PowerPC 1.25 GHz, 512MB RAM; Ethernet ID: 0011248BA83C",,,,Computers,Power Mac G5 420274,Apple,A1047,G88292MBXYL,420274,0203C,"Quad-Core Intel processor, 2.8 GHz, 2 GB of RAM, 500 GB harddrive; Running OS x 10.5.8",,,,Computers,Power Mac G5 S1,Apple,A1047,G88292MAXYL,420275,0203C,"Quad-Core Intel Xeon 2.8 GHz, 2 GB RAM; Running OS X 10.6.8",,,,Computers,Dell Intel Desktop,Dell,DHS,F5Y6W21,420321,0203C,"Windows XP OS, Version 2002; Intel Pentium 4 CPU 2.4 GHZ, 512 MB of RAM, 40 GB harddisk;",,,,Computers,"Mac Mini (Intel) ""Macadamia"" 420322",Apple,A1176,YM90703TYL4,420322,0203C,"2GHz Intel Core 2 Duo 2GB 667 MHz DDR2 SDRAM 150 GB Hard Drive, Mac OSX 10.6.8; Mac Address:00:23:6c:7b:e9:9a Ethernet ID 001FF346E9D8",,,,Computers,Mac Mini (Intel) 420331,Apple,A1176,G88485QYL2,420331,0203C,"Intel Core Duo 2 GHZ, 1GB, 120GB; EMC No: 2108; Ethernet ID: 001FF34601A5",,,,Computers,Mac Mini - Plusle - (Intel) 420405,Apple,A1283,YM0130L89G6,420405,0203C,"Intel Core Duo 2.53 GHZ, 4Gb RAM, 320GB; Airport ID: 90:84:0D:F6:2C:5F; Ethernet ID: 34:15:9E:19:00:E2 Bluetooth ID: 90:84:0D:F6:25:CF; Firewire 800, Two video outs: MiniDisplay Port and Mini-DVI",,,,Computers,Power Mac G5,Apple,A1047,H00271AQ20H,420435,0203C,"Quad-Core Intel Xeon processor, 2.26 GHz, 16 GB RAM, 3 TB harddrive(s); AirPort ID: 002608fcc5e4, Ethernet ID 1: E8 06 88 CA 80 EO, Ethernet ID 2: E8 06 88 CA 87 BB, Bluetooth ID: 7C 6D 62 A2 26 50",,,,Computers,AcerPower 2000 PC,Acer,Acer Power 2000,PSP410Z0027090D8452703,420515,0203C,"Windows Vsita OS, CO.B1201.001, product key #:00144016473517",,,,Computers,"Acer Aspire Windows Machine ""Letterman""",Acer,M3910,10403431927,420521,0203C,"Windows 7 Intel Core i3 Processor, 6GB DDR3 RAM, 1tb Harddrive, Multi-DVD burner Intel GMA graphics card; Physical MAC (Hardware MAC) 10-78-D2-C1-A2-62; nVidia GeForce 560 2GB GDDR5 Memory; Corsair power supply; The wifi nic card Anatel PCI-E WLAN card, sn: NI1020003710200D610100;",,,,Computers,"Mac Mini - ""Minun"" (Intel)",Apple,A1283,H00062BW9G8,420394,0203C,"Intel Core Duo 2.66 GHz, 4GB of RAM, 320 GB; EMC No: 2336; Ethernet ID:0026BB5FE9E0",,